title,company,job_location,job_state,date,site,job_description,salary,url,applied,search_term,flat_skills,skills_by_category
Senior Web Developer,Novaqube Limited,Remote,remote,2025-08-04,Indeed,"Web Developer (Laravel / PHP)
Location: Remote
Job Type: Full-time
Salary: Competitive – with increases over time
About Us
We’re a fast-growing UK-based start-up working on exciting web and digital projects. Our team is small, friendly, and ambitious. We’re looking for someone who’s ready to grow with us and help shape the future of our products. If you’re passionate about clean code, solving problems, and building useful tools, you could be a great fit.
About the Role
We're hiring a Web Developer with strong experience in Laravel and PHP. You'll work on a product we have built with multiple layers, from creating new features to maintaining existing systems. You’ll be part of a close-knit team, collaborating on projects, attending online meetings, and helping to meet deadlines.
This is a great opportunity for someone who is ready to grow, learn quickly, and take ownership of their work.
Key Responsibilities
Build and maintain web applications using Laravel and PHP
Work with MySQL databases and Laravel's Eloquent ORM
Create and consume RESTful APIs
Collaborate with team members during planning and development
Write clean, well-documented code and follow best practices
Attend team meetings and provide progress updates
Meet project deadlines and manage your workload effectively
Skills & Experience RequiredLaravel & PHP
Solid hands-on experience with Laravel framework
Strong knowledge of PHP and object-oriented programming
Understanding of MVC architecture and Laravel Blade templates
Experience working with Laravel routing, middleware, migrations, and Eloquent ORM
Knowledge of Laravel features like Artisan, Queues, Jobs, Events, and Notifications
Understanding of security best practices (validation, sanitisation, authentication)
General Technical Skills
Good knowledge of MySQL (or other relational databases)
Basic experience with HTML, CSS, and JavaScript
Familiar with Git version control (GitHub, GitLab, etc.)
Experience testing and debugging code
Comfortable working on live sites and doing deployments
Soft Skills & Work Style
Fast learner who enjoys solving problems
Well-spoken and clear written English (you’ll join meetings and communicate with the team)
Team player who can collaborate, give and receive feedback
Self-motivated and organised – able to manage your time and tasks
Willing to ask questions and seek support when needed
Qualifications Required
We care more about your real-world experience than formal education, but ideally, you’ll have:
Essential
2+ years of experience with Laravel and PHP
Portfolio, GitHub, or links to real projects
Strong understanding of full-stack web development basics
Good command of spoken and written English
Comfortable working independently and in a remote team
Nice to Have (Not Required)
Degree or diploma in Computer Science or related field
Experience working in a start-up or agency environment
Familiarity with tools like Laravel Livewire, Inertia.js, or Vue.js
Knowledge of Docker, basic server setup, or deployment tools
Experience with Agile or Scrum workflows
What We Offer
Friendly and flexible remote working environment
Competitive salary that increases over time as you grow
Opportunities to work on exciting projects from day one
Real career growth – your role and responsibilities can expand over time
A chance to help shape the future of a growing company
How to Apply
Send us your CV, a link to your GitHub or portfolio, and a short note telling us why you think this role is a good fit for you. We’re excited to meet developers who care about quality and want to grow with us.
Job Types: Full-time, Contract, Permanent
Pay: $6,000.00 - $10,000.00 per year
Benefits:
Flexible schedule
Work Location: Remote",N/A,https://www.indeed.com/rc/clk?jk=c402be9f7715265c&bb=jktLLJENi82qk34v4P6Rf7rUPkA2T3pYskGU0gUlLayNTjnadJWsMo1W0mIeQOvM7KDj3JxptgUQWqeBqhOcU4IBmtWEYHh1f5X8fSGRq7QPMAzjPZkeRMUD9pGlhx7RB9UaG51JRBNtLq42vI4JWQ%3D%3D&xkcb=SoAm67M3v6hR6dS-tB0DbzkdCdPP&fccid=37c2e9391233fb28&cmp=Novaqube-Limited&ti=Senior+Web+Developer&vjs=3,False,vue.js developer,"['agile', 'clean code', 'css', 'docker', 'git', 'github', 'gitlab', 'html', 'laravel', 'mysql', 'orm', 'scrum', 'security', 'testing', 'version control', 'vue.js']",{}
React Developer (Contract),Zabble,Remote,remote,2025-08-04,Indeed,"React Developer (Contract)
Zabble is looking for a React Frontend Developer who is interested in joining a small, mission-oriented, stable and growing tech company with patented solutions for the waste industry to build the future of waste management. This is a contract position with variable hours up to 20 hours per week, with the goal of helping us upgrade our web-facing application for a superior user experience.
ABOUT YOU
You are sharp, creative and detail-oriented. You love working with other people in a remote capacity. You have an eye for clear, intuitive design. You can tell the difference between React and Angular without breaking a sweat. You like being organized with your documentation and code and maintain a high standard for quality. You're an outstanding communicator and collaborator with top-notch coding skills. And you are a self-starter who thinks from the user's standpoint, from design and requirements gathering to performance improvements.
ABOUT THE ROLE
You will be responsible for the web-facing side of Zabble's platform. That means you'll be building intuitive, performant, and seamless user interfaces — to make sure the Zabble experience is best-in-class.
Here are the skills and experiences you'll need:
Bachelor's degree in Computer Science, Electrical Engineering, Software Engineering, or similar
Minimum 5 years of professional experience as a full-time employee developing production-grade front end web applications
Experience working for a SaaS company
Advanced working knowledge of JavaScript, CSS, and HTML
Advanced working knowledge of React (latest version)
Demonstrable experience consuming REST APIs
Proficient in a broad range of software design approaches and common UX patterns
Experience with microservice architecture (especially AWS)
Understanding of version control & git (with Bitbucket experience preferred)
Experience with unit, integration, and end-to-end testing
Grasp of the Agile development process (experience with Jira is a plus)
Basic knowledge of charts, plots and analytical tools
MORE DETAILS
Hourly rate between $50-$65 depending on location and experience
This is a remote position; applicants must have flexibility to collaborate with colleagues working in multiple time zones
Due to U.S. government grant restrictions, applicants must currently be U.S. citizens or U.S. permanent residents
This position reports to the Director of Product",N/A,https://www.indeed.com/rc/clk?jk=1af731173156cb8f&bb=jktLLJENi82qk34v4P6Rf_2xTXN3sXH9CA-Zsu9MekrRtm8LCTu9D00JBqVpDntieUpkz4kOMOnIyHI2KIXfUZ2_E1gVavINOqODjq60Nsx8UXV7vYAqn9mSFYgIQM8mYyLUS6OysstkPj9bPX8D5w%3D%3D&xkcb=SoCS67M3v6hR6dS-tB0CbzkdCdPP&fccid=d1e0e836f7d3695e&vjs=3,False,vue.js developer,"['agile', 'angular', 'aws', 'css', 'documentation', 'end-to-end testing', 'flexibility', 'frontend', 'git', 'html', 'jira', 'react', 'testing', 'user experience', 'version control']",{}
Senior Web Developer,Novaqube Limited,Remote,remote,2025-08-04,Indeed,"Web Developer (Laravel / PHP)
Location: Remote
Job Type: Full-time
Salary: Competitive – with increases over time
About Us
We’re a fast-growing UK-based start-up working on exciting web and digital projects. Our team is small, friendly, and ambitious. We’re looking for someone who’s ready to grow with us and help shape the future of our products. If you’re passionate about clean code, solving problems, and building useful tools, you could be a great fit.
About the Role
We're hiring a Web Developer with strong experience in Laravel and PHP. You'll work on a product we have built with multiple layers, from creating new features to maintaining existing systems. You’ll be part of a close-knit team, collaborating on projects, attending online meetings, and helping to meet deadlines.
This is a great opportunity for someone who is ready to grow, learn quickly, and take ownership of their work.
Key Responsibilities
Build and maintain web applications using Laravel and PHP
Work with MySQL databases and Laravel's Eloquent ORM
Create and consume RESTful APIs
Collaborate with team members during planning and development
Write clean, well-documented code and follow best practices
Attend team meetings and provide progress updates
Meet project deadlines and manage your workload effectively
Skills & Experience RequiredLaravel & PHP
Solid hands-on experience with Laravel framework
Strong knowledge of PHP and object-oriented programming
Understanding of MVC architecture and Laravel Blade templates
Experience working with Laravel routing, middleware, migrations, and Eloquent ORM
Knowledge of Laravel features like Artisan, Queues, Jobs, Events, and Notifications
Understanding of security best practices (validation, sanitisation, authentication)
General Technical Skills
Good knowledge of MySQL (or other relational databases)
Basic experience with HTML, CSS, and JavaScript
Familiar with Git version control (GitHub, GitLab, etc.)
Experience testing and debugging code
Comfortable working on live sites and doing deployments
Soft Skills & Work Style
Fast learner who enjoys solving problems
Well-spoken and clear written English (you’ll join meetings and communicate with the team)
Team player who can collaborate, give and receive feedback
Self-motivated and organised – able to manage your time and tasks
Willing to ask questions and seek support when needed
Qualifications Required
We care more about your real-world experience than formal education, but ideally, you’ll have:
Essential
2+ years of experience with Laravel and PHP
Portfolio, GitHub, or links to real projects
Strong understanding of full-stack web development basics
Good command of spoken and written English
Comfortable working independently and in a remote team
Nice to Have (Not Required)
Degree or diploma in Computer Science or related field
Experience working in a start-up or agency environment
Familiarity with tools like Laravel Livewire, Inertia.js, or Vue.js
Knowledge of Docker, basic server setup, or deployment tools
Experience with Agile or Scrum workflows
What We Offer
Friendly and flexible remote working environment
Competitive salary that increases over time as you grow
Opportunities to work on exciting projects from day one
Real career growth – your role and responsibilities can expand over time
A chance to help shape the future of a growing company
How to Apply
Send us your CV, a link to your GitHub or portfolio, and a short note telling us why you think this role is a good fit for you. We’re excited to meet developers who care about quality and want to grow with us.
Job Types: Full-time, Contract, Permanent
Pay: $6,000.00 - $10,000.00 per year
Benefits:
Flexible schedule
Work Location: Remote",N/A,https://www.indeed.com/rc/clk?jk=c402be9f7715265c&bb=zeypaRF2-f9iFNg4vPRqPSKYYJZhAUQS4rgTWQoxh_YYYuInrqj9QG6vrvxbWl6Ivp7kzFrEuwBnkohDtMrYG5snIvjCVRY61hFjH0J_N_QZB7Oj8Udspp6bLCaWMBtq3XZ8r711EybbOEJ0vB7aSg%3D%3D&xkcb=SoA467M3v6hsIVy7gh0LbzkdCdPP&fccid=37c2e9391233fb28&cmp=Novaqube-Limited&ti=Senior+Web+Developer&vjs=3,False,angular developer,"['agile', 'clean code', 'css', 'docker', 'git', 'github', 'gitlab', 'html', 'laravel', 'mysql', 'orm', 'scrum', 'security', 'testing', 'version control', 'vue.js']",{}
Senior Full Stack Engineer - MN Based,GovDocs,"Remote in Saint Paul, MN 55121","remote in saint paul, mn 55121",2025-08-04,Indeed,"Job Title: Senior Software Engineer
Reports to: Director of Software Engineering
Status: Regular Full Time
Now Hiring: Senior Full Stack Engineer
We’re growing our engineering team and hiring a Senior Full Stack Engineer to help shape the next generation of our software products. This role leans toward backend development and offers a high impact opportunity to build modern cloud-native software that directly improves how companies navigate complex legal compliance. You'll work on a cross-functional team, solve interesting problems, grow and mentor others while delivering high-quality software.
What You’ll Do:
Design and build full-stack product features using TypeScript, React (with Mantine), and AWS serverless technologies following well-established design patterns and engineering practices
Write clean, maintainable, well-tested code and participate in code reviews
Debug and resolve issues across the stack
Collaborate with product managers, designers, and engineers to deliver valuable functionality
Mentor teammates and foster a culture of ownership, learning, and inclusion Promote high standards in engineering quality, operational excellence, and team collaboration
Lead backend development of microservices in AWS with a domain-driven approach to API design and data modeling, ensuring scalable and maintainable systems
What You Bring:
5+ years of recent and relevant experience designing, building, and scaling cloud-native software and services
Fluency across the stack, from backend APIs and databases like MongoDB to modern JavaScript/TypeScript frameworks such as React and Mantine
Solid understanding of software design patterns, testing practices, and system architecture
Clear communication, thoughtful collaboration, and a mindset of ownership and impact
Passion for building software that improves people’s lives
Strong experience developing backend microservices using AWS, serverless architectures (including Lambda), containers, and NoSQL databases like MongoDB
Who You Are:
You lead by example and share your passion to inspire those around you for growth. You are authentic, driven and positive.
You possess emotional intelligence and empathy. You have a good sense of humor, are self-aware and self-critical, but not arrogant. You handle interpersonal dynamics with grace.
You do more than the minimum to achieve outstanding results by being hands-on and rolling up your sleeves now and again when it’s necessary.
You thrive in a growth-oriented company by embracing and adapting to changes easily. You are open-minded and flexible.
Your clear communication fosters understanding and collaboration. You express ideas effectively but are also an active listener.
Flexible Work Model:
We believe the best way for us to grow is by creating a work environment that offers greater flexibility. This means providing opportunities for employees to be together in the office a few days per week, where interactions can occur more frequently and effectively. Being in person helps foster collaboration and team engagement, which is especially important when addressing complex problems and driving business innovation. At the same time, we value the focused, uninterrupted time that working from home provides, allowing for more dedicated project and productive work with minimal distractions.
Best Places to Work 2024:
GovDocs was named one of the 2024 Best Places to Work by the Minneapolis/St. Paul Business Journal! Being named an honoree was no easy feat, as they received over 300 nominations for this year’s award. GovDocs was one of the top-scoring Minnesota businesses honored in the medium company category (50-250 employees) for creating a fun, challenging, and rewarding workplace. Read more about GovDocs as Best Places to Work 2024 here: https://bizj.us/1qlh8s
Company Description:
GovDocs serves companies in building and executing their employment law compliance programs in two primary ways:
Employment Law Posting Update Program: We manage all the complexities of identifying and providing the required set of employment law postings from the 1,700+ potential postings across the U.S. and Canada. Using proprietary technology, we allow companies to manage, track and verify postings at each of their locations – including our patent pending PosterCheck technology. Our Employment Law Posting Update service is used by almost 22% of the Fortune 500 and 30% of the Fortune 100.
Employment Law Compliance Software Solutions: This is a first to market Software-as-a-Service starting with our Minimum Wage product and Paid Leave products, which allow companies to identify and track which laws apply to their locations and employees, then provides all relevant data to make decisions. This service was created in response to requests from some of our largest customers who recognized that employment law expansion across and variances between jurisdictions (Federal, State and Local) were too difficult to manually track.
GovDocs has grown revenue annually by 18% since 2008 with a 96% customer retention rate, primarily due to our Postings Update Program both obtaining and retaining customers – as employment law postings are required by law, every company has an existing provider. Our Software Solutions are an entirely new line of business that gives us great growth potential to create a full Employment Law Compliance (ELC) platform of solutions, it is also challenging us to reinvent how we view urgency, innovation and teamwork. You must be authorized to work in the United States. Immigration or work visa sponsorship will not be provided. In compliance with federal law, all persons hired will be required to verify identity and eligibility to work in the United States and to complete the required employment eligibility verification form upon hire.
Compensation:
This position is critical to the success of our business and the compensation package will be commensurate with candidate's experience and skills. This role will include a base salary and performance-based incentives. Benefits include paid vacation, paid volunteer time, paid holidays, medical insurance, dental insurance, vision insurance, flexible spending account, health savings account, group life insurance, voluntary life insurance, group short-term disability, group long-term disability, critical illness insurance, accident insurance, hospital indemnity insurance, a matching 401(k), employee assistance programs, pet health insurance, and value-added programs.
Base salary range: $130,000 – $150,000
Send resume, salary requirements and cover letter to careers@govdocs.com
Job Type: Full-time
Pay: $130,000.00 - $150,000.00 per year
Benefits:
401(k)
Dental insurance
Disability insurance
Employee assistance program
Flexible spending account
Health insurance
Health savings account
Life insurance
Paid time off
Vision insurance
Compensation Package:
Bonus opportunities
Schedule:
Monday to Friday
Application Question(s):
Will you now or in the future require sponsorship for an employment visa?
What are your salary expectations for this role?
Are you willing and able to commute to the office twice per week?
Work Location: Hybrid remote in Saint Paul, MN 55121",N/A,https://www.indeed.com/pagead/clk?mo=r&ad=-6NYlbfkN0BGIiyFZA8n3e8itLDYjqUput7VY33e9AxWJ788CjtX8yaoQds01nQujX0gpiDVLXdxqXwBHPhTb1s5vxXF4QtNz648GjKOdYWKoWyoWKiafcOSfeo61Z39p2JYFFtolP80r1QpVWzVYzlcYK0HDzqebPegTU9_8CNBqYlHPynWVOn2fHmZ9xFBQYX81LCuSjDAJmzn76IK3jMeKJpaiYC7KavFRhUdJXfMe2iGvhdBhYlDde4NTNRYOTKeml2A5I2RSifjW5nRv_-SegSwFcv1j7XihguQBDEaYwycpklCv5PNamltZ0qGEkaGQKueIPB4lPTc0S11LdRIiiwEU7aXgxKdYwVtSZhx8xMLHN4PxCbq6r3WSpVqJ9qIOERDgVMUl_3GZA9n3QEFZYBZZ2FKPOFkWVtUjUr_ryRMF970ACZIHtOQnBgfhXjzxdGmVyVgi4fJJYChyAaYT9OLZeP3WpG1bZQR_28TkLR_rsa1kUH6xAESuGbAMrm6d7RyQcq20FcPuibyMlhRTe3RdOBuNzePdiQeOwHpOqQfpCGEqQIHgoTB_--mv5Nc4fmNc8ARFpbyHRvKNNGuB4Vv3kKWunRC14zwVilZgRq0ninhzSITXj4PMIsQ-3T72Li9eqlfQgUb_oC1qkOl-NejS1e-l6DxoOsmyL1kf43qTiC6nqzLyRubaW5q&xkcb=SoAR6_M3v6hm8JgQLb0SbzkdCdPP&camk=ethIe0s0hec3AaRg2I-t5w==&p=0&fvj=0&vjs=3,False,javascript developer,"['aws', 'collaboration', 'communication', 'compliance', 'design patterns', 'emotional intelligence', 'flexibility', 'innovation', 'microservices', 'mongodb', 'react', 'sense of humor', 'serverless', 'teamwork', 'testing', 'typescript']",{}
Senior Web Developer,Novaqube Limited,Remote,remote,2025-08-04,Indeed,"Web Developer (Laravel / PHP)
Location: Remote
Job Type: Full-time
Salary: Competitive – with increases over time
About Us
We’re a fast-growing UK-based start-up working on exciting web and digital projects. Our team is small, friendly, and ambitious. We’re looking for someone who’s ready to grow with us and help shape the future of our products. If you’re passionate about clean code, solving problems, and building useful tools, you could be a great fit.
About the Role
We're hiring a Web Developer with strong experience in Laravel and PHP. You'll work on a product we have built with multiple layers, from creating new features to maintaining existing systems. You’ll be part of a close-knit team, collaborating on projects, attending online meetings, and helping to meet deadlines.
This is a great opportunity for someone who is ready to grow, learn quickly, and take ownership of their work.
Key Responsibilities
Build and maintain web applications using Laravel and PHP
Work with MySQL databases and Laravel's Eloquent ORM
Create and consume RESTful APIs
Collaborate with team members during planning and development
Write clean, well-documented code and follow best practices
Attend team meetings and provide progress updates
Meet project deadlines and manage your workload effectively
Skills & Experience RequiredLaravel & PHP
Solid hands-on experience with Laravel framework
Strong knowledge of PHP and object-oriented programming
Understanding of MVC architecture and Laravel Blade templates
Experience working with Laravel routing, middleware, migrations, and Eloquent ORM
Knowledge of Laravel features like Artisan, Queues, Jobs, Events, and Notifications
Understanding of security best practices (validation, sanitisation, authentication)
General Technical Skills
Good knowledge of MySQL (or other relational databases)
Basic experience with HTML, CSS, and JavaScript
Familiar with Git version control (GitHub, GitLab, etc.)
Experience testing and debugging code
Comfortable working on live sites and doing deployments
Soft Skills & Work Style
Fast learner who enjoys solving problems
Well-spoken and clear written English (you’ll join meetings and communicate with the team)
Team player who can collaborate, give and receive feedback
Self-motivated and organised – able to manage your time and tasks
Willing to ask questions and seek support when needed
Qualifications Required
We care more about your real-world experience than formal education, but ideally, you’ll have:
Essential
2+ years of experience with Laravel and PHP
Portfolio, GitHub, or links to real projects
Strong understanding of full-stack web development basics
Good command of spoken and written English
Comfortable working independently and in a remote team
Nice to Have (Not Required)
Degree or diploma in Computer Science or related field
Experience working in a start-up or agency environment
Familiarity with tools like Laravel Livewire, Inertia.js, or Vue.js
Knowledge of Docker, basic server setup, or deployment tools
Experience with Agile or Scrum workflows
What We Offer
Friendly and flexible remote working environment
Competitive salary that increases over time as you grow
Opportunities to work on exciting projects from day one
Real career growth – your role and responsibilities can expand over time
A chance to help shape the future of a growing company
How to Apply
Send us your CV, a link to your GitHub or portfolio, and a short note telling us why you think this role is a good fit for you. We’re excited to meet developers who care about quality and want to grow with us.
Job Types: Full-time, Contract, Permanent
Pay: $6,000.00 - $10,000.00 per year
Benefits:
Flexible schedule
Work Location: Remote",N/A,https://www.indeed.com/rc/clk?jk=c402be9f7715265c&bb=8YbiA2O4WZisBW8IXBvG7qAxXmt_JFvs-bdYvPo4nh1VRHV26VrmDkjZsHQA4Gv9mK2YHi1ES_qhge-COrLoUjv14pFePtf65mkS1x27HtPD9Apvuh8SkibiQ-sSyKkOsB7Dm92Zgw3N2z-uFCrS1U-EeoKDgPmS&xkcb=SoB467M3v6hm8JgQLb0RbzkdCdPP&fccid=37c2e9391233fb28&cmp=Novaqube-Limited&ti=Senior+Web+Developer&vjs=3,False,javascript developer,"['agile', 'clean code', 'css', 'docker', 'git', 'github', 'gitlab', 'html', 'laravel', 'mysql', 'orm', 'scrum', 'security', 'testing', 'version control', 'vue.js']",{}
