title,company,job_location,job_state,date,site,job_description,salary,url,applied,search_term,flat_skills,skills_by_category
"Senior Software Engineer, Editor, Front End",Paperless Post,"Remote in New York, NY","remote in new york, ny",2025-08-04,Indeed,"Paperless Post is seeking an expert JavaScript developer to help architect and maintain our Front End application with more than five million unique visitors per month. In this role, you'll work within a dedicated and fully staffed feature team to build and maintain user-facing features and libraries that are essential for cross-functional development teams.
You will work with React, Redux, and NextJS to build a robust platform and suite of creative tools for helping our users and admins create beautiful event pages, greeting cards, and custom media. You'll use your experience building performant user-focused web applications to deliver exceptional software across device types and platforms. Your contributions will make a meaningful impact to a complex consumer product and be used by millions of users.
A little bit about us
The Paperless Post Engineering team, a highly collaborative group of developers and technologists, is charged with building and refining a consumer-facing product that millions of people interact with each month. Our individual feature teams each focus on a unique piece of the user experience and are made up of engineers, product managers, quality assurrers, and product designers. We prioritize creativity and continuing education, and our ongoing commitment to quality code shows in our pragmatic but brave approach to technology.
What you'll do here
Maintain and implement a web-based editor and suite of creative tools for dynamic webpage construction, used by our users and in-house content team.
Contribute to a React (NextJS) and GraphQL codebase that is peer-reviewed and part of our continuous deployment pipeline.
Actively participate in developing useful API contracts between Front End and Back End
Coordinate between technical leads on best practices and align on implementation strategies.
Work closely with Product Management and Product Design to communicate new feature designs to other members of the team.
Work closely with stakeholders on the team to arrive at the priorities and requirements the team will proceed with.
What you bring to the table
9+ years of experience in professional software development
Experience and confidence working with modern Front End development practices.
Experience working in and shipping features inside an established, complex codebase
Experience developing creative tools and working with graphics libraries is a plus.
Ability to lead projects and feature development from definition through implementation
Ability to communicate complex concepts with both technical and non-technical stakeholders
Proficient in building consensus among collaborators and peers
Exposure to full-stack development, including familiarity in designing APIs, working with databases, and monitoring application performance.
Proficient in leveraging AI tools (Coding agents, LLMs, etc.) as part of your workflow
Experience in Node.js, Ruby on Rails, or Go are all pluses.
Company-wide, we enjoy an amazing ecosystem of an even gender split and a balance of engineers and designers. Because Paperless Post isn't supported by ad revenue, we can focus our efforts on creating and improving on the ideal version of our platform, product, content, and partnerships for our users.
We are proud that Paperless Post has helped over 175 million people globally connect in the real world since our inception. Paperless Post exists to help all people celebrate all the moments that matter to them. We believe that having a team reflective of the diverse world around us empowers us to create a product that serves everyone. Women, people of color, trans/genderqueer individuals, individuals with disabilities, and veterans are especially encouraged to apply.
The compensation range for this role is $142,000-$190,000 USD.
At Paperless Post, compensation is based on a number of factors, including geographic location, job-related skills, years of experience, and internal team banding. All full-time offer packages come with a base salary, equity component, and options for fully paid medical, dental, and vision benefits. The range posted here is based on the NYC market and may vary based on candidate location.",N/A,https://www.indeed.com/rc/clk?jk=d88ebdfc10d3bf03&bb=gMRcYoo-AT50zWO85axbfZk8ISWj5e23OtN_qW4BDzUMLegJHck_--EgsQuivN6q-YfKXKpO_0ZMxldLycPzuTQioWx0pvW_2wiTbYU-uI14gkTMrtzRCPGysjcXbiDd2wjjgotB2w0KEPsw0WrFyQ%3D%3D&xkcb=SoDS67M3v6hA6wgQeL0IbzkdCdPP&fccid=c618ba0d5e55039b&vjs=3,False,front-end developer,"['ai', 'creativity', 'full-stack development', 'go', 'graphql', 'node.js', 'react', 'ruby', 'ruby on rails', 'user experience']",{}
Senior Front End Software Engineer,Angel,Remote,remote,2025-08-04,Indeed,"Summary/objective:
Angel Studios is seeking an expert React.js developer to build front-end web applications as a member of a fully-remote engineering team.

Essential functions
Ensure quality through design, processes, and tools in a CI/CD environment.
Partner with designers, product managers, and engineers to build out new features, fixes, and continuous improvements.
Deliver features quickly and iteratively.
Design, build and maintain efficient, secure, reusable, and reliable code that runs performantly across devices under variable memory, screen size, and network constraints.
Participate in cross-team brownbags, workshop series, standups, hackathons, etc.
Analyze application performance and recommend improvements as needed.
Perform code reviews, testing, and debugging.
Provide expert front-end guidance to other engineers.
Contribute to technical documentation utilized in the Product and Engineering departments.
Must attend and contribute to scheduled meetings.
Proficiency in speaking, reading and writing in the English language is required. Additional language proficiency is a plus.

Reasonable accommodations may be made to enable individuals with disabilities to perform these essential functions.

Competencies
Experience with the infrastructure needed to make compelling frontend experiences, such as API development.
Passionate about careful component design & architectural planning that leads to a codebase that is future-proof and maintainable.
Enjoy the challenge and opportunity to lead and improve the development experience at Angel Studios by enhancing development tools, test coverage, and code structure.
Proactive and detail-oriented, yet comfortable working in a dynamic environment with tight deadlines and evolving requirements.
Self-starter with the ability to seek out opportunities, create an action plan and see it through to fruition.
Familiarity with Cloud Based Platforms and services.
Strong collaborator with excellent presentation, communication, and problem solving skills.
Familiarity with Continuous Integration and Continuous Delivery principles.
An exceptional listener with excellent written and verbal communication skills.
Detail-oriented perspective and able to pick up on overlooked details.
Organization and time management.
Able to maintain confidentiality of information.
Must be able to manage multiple assignments, determine priorities, and adapt to changing conditions.
Resourceful and able to problem-solve and manage tasks with ambiguity.
Can take feedback to tasks and assignments positively and create better solutions.
A quick study, able to pick up new skills and learn how to use new tools and programs.
Ability to take individual ownership, execute with high energy, share context, insist on candor with positive intent.
Required experience
7+ years of experience as a Software Engineer
5+ years of experience building front-end web applications
3+ years of experience within the last 5 years using React.js to build front-end web applications
Preferred experience
Expertise in unit testing is strongly preferred
Experience with Tailwind is a plus
Experience with GraphQL is a plus
Experience with next.js is a plus
Full-stack development experience is a plus
Additional language proficiency beyond English is a plus.
Experience with the Angel Guild strongly preferred
Commensurate with experience and scope of responsibility.",N/A,https://www.indeed.com/rc/clk?jk=424a5aaab6de0c62&bb=gMRcYoo-AT50zWO85axbfXMRpO1UnRRIjebZ1qBHqvGWqYCoMRBPT3HJfYupz9IgyrlytLyJygkjwV74KjuR7QgVdIN25AfMRJ2_D3dogyVgHi0CJWQBKC0Y4RJEtyGtaAGC8tvouuO0ZtN8AFyZBA%3D%3D&xkcb=SoBc67M3v6hA6wgQeL0PbzkdCdPP&fccid=018fb5d01d494585&vjs=3,False,front-end developer,"['communication', 'confidentiality', 'documentation', 'frontend', 'full-stack development', 'graphql', 'hackathons', 'next.js', 'organization', 'problem solving', 'react', 'testing', 'time management', 'unit testing']",{}
Consultant - Front End React Engineer - eCommerce,Kalles Group,"Remote in Seattle, WA","remote in seattle, wa",2025-08-04,Indeed,"ABOUT KALLES GROUP:
Everyone deserves to be secure. Our mission at Kalles Group is to help secure the future for companies of all shapes and sizes.
While our expertise spans multiple disciplines, our method remains consistent: building trust and relationship with people - whether you are a client, a consultant, or-in this case-a candidate.
No matter what role you come from-whether you're an executive or just starting your career-you can expect our highest level of attention and respect. We want to find the right fit for each role, but we also want you to find the right fit for your career.
We believe the best way to show you what our team is like is to treat you like you're already a part of it. We hope you'll consider joining our team of experienced professionals who are building their careers at Kalles Group—and having fun while doing it.
WHAT YOU WILL DO:
The Front End React Engineer Consultant for eCommerce will use React.js concepts and workflows (ie. Redux, Server-Side Rendering, Styled Components and Storybook) to oversee the development of new and highly-responsive, web-based user interfaces in a test driven SDLC.
You will:
Work with product owners and their teams to support release planning activities; identify and define enablers and work items to support the architectural runway of products and applications.
Perform development, optimization and automation activities to support implementation of products and applications.
Develop and implement front-end architecture for user interface.
Build automated CI/CD pipelines.
Create and deliver DevSecOps automation for application deployment and testing.
Develop and execute unit tests which validate code changes made to support implementation of user stories.
Detect software defects by using test driven development (TDD) practices.
Promote enabling work at the edges supported by a core set of defined services.
Modify engagement models to support rapid test and deployment of new technology.
Promote workforce scaling model that grows with the application catalog.
Use monitoring tools (ie, Dynatrace/Splunk) and browser tools to perform waterfall analysis to identify roadblocks and improvements.
Collaborate cross-functionally to define project specs and release documents throughout project.
Utilize peer code review practices.
ABOUT YOU:
Your values:
Integrity: You believe in doing the right thing, even when it's uncomfortable, seemingly inefficient, or costly.
Purposefulness: You have a desire to serve others with your skillset and an openness to continuous learning and growth.
Ownership: You stick to your commitments, follow up with action, and seek clarity in communication & expectations.
Your experience:
Bachelor's degree or equivalent professional working experience in related field.
7+ years of experience as a React.js developer with experience in React.js, HTML, CSS3.
Additional and extensive experience in JavaScript and React concepts.
Extensive experience as a front-end developer and a passion for mentoring peers.
CSS and CSS-precompilation proficiency.
Understanding of REST and Graph QL patterns with ability to integrate third party API's.
Proficiency with Redux and Redux Sagas.
Knowledge of JavaScript ES6+ features (classes, arrow functions, template literals, promises, async/await, rest/spread operators).
Experience with browser-based debugging and performance testing software.
Ability to refactor code and algorithms.
Experience with software development for eCommerce applications.
Consulting experience is a plus!
WHAT WE OFFER:
Competitive compensation with opportunities for additional incentives. The annual salary range for this role is $110,000-$140,000.
Work/life balance – we know there's more to life than work! We encourage our team to pursue other passions, get outside, and spend time with family. We work with clients and consultants to set expectations for a manageable workload.
LOCATION:
This role is remote.
HOW TO APPLY:
Please fill out the form below (including uploading your most recent resume) and we'll be in touch! We know imposter syndrome can be a barrier to many great applicants. We hope you'll still consider applying. That's why we've made the application process as short and simple as possible.
Even if you're not a fit for the role, you can expect to hear back from us! We want you to have the best experience as a candidate, so please feel free to share feedback at any stage of the process to talent@kallesgroup.com.
Kalles Group is an equal-opportunity employer and does not discriminate on the basis of creed, nationality, race, ethnicity, disability, gender, or other protected class.",N/A,https://www.indeed.com/rc/clk?jk=5df4b9124d98fe30&bb=gMRcYoo-AT50zWO85axbfZGoXgghdgXIxRRXjbdSkgUusFmJMUmFupW0umRUgt9f0hNmOsMLhrONFHaemdWrB5hQtvGXYuCz8eD9Hp-s0TFMve3D-bv69WtsXPi0jrQl_fD57uRVOeFZ8WIpDpMO7Q%3D%3D&xkcb=SoDo67M3v6hA6wgQeL0ObzkdCdPP&fccid=aafe4567829167e9&vjs=3,False,front-end developer,"['communication', 'css', 'html', 'mentoring', 'react', 'test driven development', 'testing', 'user interface', 'user stories']",{}
Senior Front End Software Engineer,Angel,Remote,remote,2025-08-04,Indeed,"Summary/objective:
Angel Studios is seeking an expert React.js developer to build front-end web applications as a member of a fully-remote engineering team.

Essential functions
Ensure quality through design, processes, and tools in a CI/CD environment.
Partner with designers, product managers, and engineers to build out new features, fixes, and continuous improvements.
Deliver features quickly and iteratively.
Design, build and maintain efficient, secure, reusable, and reliable code that runs performantly across devices under variable memory, screen size, and network constraints.
Participate in cross-team brownbags, workshop series, standups, hackathons, etc.
Analyze application performance and recommend improvements as needed.
Perform code reviews, testing, and debugging.
Provide expert front-end guidance to other engineers.
Contribute to technical documentation utilized in the Product and Engineering departments.
Must attend and contribute to scheduled meetings.
Proficiency in speaking, reading and writing in the English language is required. Additional language proficiency is a plus.

Reasonable accommodations may be made to enable individuals with disabilities to perform these essential functions.

Competencies
Experience with the infrastructure needed to make compelling frontend experiences, such as API development.
Passionate about careful component design & architectural planning that leads to a codebase that is future-proof and maintainable.
Enjoy the challenge and opportunity to lead and improve the development experience at Angel Studios by enhancing development tools, test coverage, and code structure.
Proactive and detail-oriented, yet comfortable working in a dynamic environment with tight deadlines and evolving requirements.
Self-starter with the ability to seek out opportunities, create an action plan and see it through to fruition.
Familiarity with Cloud Based Platforms and services.
Strong collaborator with excellent presentation, communication, and problem solving skills.
Familiarity with Continuous Integration and Continuous Delivery principles.
An exceptional listener with excellent written and verbal communication skills.
Detail-oriented perspective and able to pick up on overlooked details.
Organization and time management.
Able to maintain confidentiality of information.
Must be able to manage multiple assignments, determine priorities, and adapt to changing conditions.
Resourceful and able to problem-solve and manage tasks with ambiguity.
Can take feedback to tasks and assignments positively and create better solutions.
A quick study, able to pick up new skills and learn how to use new tools and programs.
Ability to take individual ownership, execute with high energy, share context, insist on candor with positive intent.
Required experience
7+ years of experience as a Software Engineer
5+ years of experience building front-end web applications
3+ years of experience within the last 5 years using React.js to build front-end web applications
Preferred experience
Expertise in unit testing is strongly preferred
Experience with Tailwind is a plus
Experience with GraphQL is a plus
Experience with next.js is a plus
Full-stack development experience is a plus
Additional language proficiency beyond English is a plus.
Experience with the Angel Guild strongly preferred
Commensurate with experience and scope of responsibility.",N/A,https://www.indeed.com/rc/clk?jk=424a5aaab6de0c62&bb=wFYP4PBdl8mklrXhKvuX642fJGR2Bpt3FUS8k3IscnpClygB-4pfNFjbQpncoK4iPyKfK9J2EHvhnZ9EwQvqSx__SOJF6xM7L_lOXnfX6l1irP3XuOcMjqPpYy0KAirxt5mCtBOGMpMjPP5k3gRppw%3D%3D&xkcb=SoD967M3v6hXnVgQeL0LbzkdCdPP&fccid=018fb5d01d494585&vjs=3,False,react developer,"['communication', 'confidentiality', 'documentation', 'frontend', 'full-stack development', 'graphql', 'hackathons', 'next.js', 'organization', 'problem solving', 'react', 'testing', 'time management', 'unit testing']",{}
Product Growth Engineer (React / Tailwind),Speechify,Remote,remote,2025-08-04,Indeed,"The mission of Speechify is to make sure that reading is never a barrier to learning.
Over 30 million people use Speechify's text-to-speech products to turn whatever they're reading – PDFs, books, Google Docs, news articles, websites – into audio, so they can read faster, read more, and remember more. Speechify's text-to-speech reading products include its iOS app, Android App, Mac App, Chrome Extension, and Web App. Google recently named Speechify the Chrome Extension of the Year and Apple named Speechify its App of the Day.
Today, nearly 200 people around the globe work on Speechify in a 100% distributed setting – Speechify has no office. These include frontend and backend engineers, AI research scientists, and others from Amazon, Microsoft, and Google, leading PhD programs like Stanford, high growth startups like Stripe, Vercel, Bolt, and many founders of their own companies.
Overview
We're looking for a fast, product-minded engineer to own and ship onboarding flows, in-app guidance, product documentation, ""what's new"" surfaces, and integrated support that makes Speechify Studio intuitive from day one. You'll operate at the intersection of UX, frontend, growth, and customer success.
You'll build React + Tailwind components, wire up tools like Intercom, Amplitude, and OpenAI APIs, and drive a seamless experience for both new and returning users. You'll also connect analytics to our lifecycle and customer engagement tools—email, in-app messages, advertising—working closely with marketing to close the loop between product and growth. Expect to own both the interface and the language inside it, ship fast, and iterate constantly.
What You'll Do
Build and maintain user onboarding, in-app tours, and changelogs
Create and keep up-to-date tutorials and product documentation
Integrate support tools (Intercom bots, contextual FAQs, help surfaces)
Connect analytics (Amplitude) to lifecycle tools (email, ads, CRM)
Use OpenAI APIs to power dynamic product tips and smart helpers
Polish UI with Tailwind, always aiming for clarity, speed, and brand alignment
An Ideal Candidate Should Have
5+ years with React, TypeScript, and Tailwind
Excellent written English—you're as confident writing copy as writing code
Hands-on experience building onboarding, documentation, or growth loops
Comfort with Amplitude, Intercom, OpenAI APIs, and email/CRM integration
You ship fast, iterate constantly, and thrive with full ownership
What We Offer
A dynamic environment where your contributions shape the company and its products
A team that values innovation, intuition, and drive
Autonomy, fostering focus and creativity
The opportunity to have a significant impact in a revolutionary industry
Competitive compensation, a welcoming atmosphere, and a commitment to an exceptional asynchronous work culture
The privilege of working on a product that changes lives, particularly for those with learning differences like dyslexia, ADD, and more
An active role at the intersection of artificial intelligence and audio – a rapidly evolving tech domain
Why Join:
You'll own critical surfaces that shape how users experience Speechify from day one. You'll ship often, work across product and marketing, and play a key role in helping us scale user satisfaction, retention, and growth.
Salary
The United States base salary range for this full-time position is $140,000-$200,000 + bonus + equity depending on experience
Think you're a good fit for this job?
Tell us more about yourself and why you're interested in the role when you apply.
And don't forget to include links to your portfolio and LinkedIn.
Not looking but know someone who would make a great fit?
Refer them!
Speechify is committed to a diverse and inclusive workplace.
Speechify does not discriminate on the basis of race, national origin, gender, gender identity, sexual orientation, protected veteran status, disability, age, or other legally protected status.",N/A,https://www.indeed.com/rc/clk?jk=f98fd7157af9216d&bb=wFYP4PBdl8mklrXhKvuX64vnkvN_xZoO9Aj3ZUlyTv1iyG6_9ZtdHCxxGfrF58CMavFkftFVlwIZn0DzIUkUTLdjdOeAAulruB-rAgmIBgsMYaL7dtYBb8WtDuChYGJQiQgLN7bPTc3JhoAkEEvZHw%3D%3D&xkcb=SoBJ67M3v6hXnVgQeL0KbzkdCdPP&fccid=ce1ba0373c780aad&vjs=3,False,react developer,"['ai', 'creativity', 'documentation', 'frontend', 'innovation', 'openai', 'react', 'stripe', 'typescript', 'vercel']",{}
