title,company,job_location,job_state,date,site,job_description,salary,url,applied,search_term,flat_skills,skills_by_category
"Engineer Sr, Software Development",Solventum,"Remote in Dallas, TX 75201","remote in dallas, tx 75201",2025-08-04,Indeed,"Thank you for your interest in working for our Company. Recruiting the right talent is crucial to our goals. On April 1, 2024, 3M Healthcare underwent a corporate spin-off leading to the creation of a new company named Solventum. We are still in the process of updating our Careers Page and applicant documents, which currently have 3M branding. Please bear with us. In the interim, our Privacy Policy here: https://www.solventum.com/en-us/home/legal/website-privacy-statement/applicant-privacy/ continues to apply to any personal information you submit, and the 3M-branded positions listed on our Careers Page are for Solventum positions. As it was with 3M, at Solventum all qualified applicants will receive consideration for employment without regard to their race, color, religion, sex, sexual orientation, gender identity, national origin, disability, or status as a protected veteran.
Job Description:
Software Engineer (Solventum)
At Solventum, we enable better, smarter, safer healthcare to improve lives. As a new company with a long legacy of creating breakthrough solutions for our customers’ toughest challenges, we pioneer game-changing innovations at the intersection of health, material and data science that change patients' lives for the better while enabling healthcare professionals to perform at their best. Because people, and their wellbeing, are at the heart of every scientific advancement we pursue.
We partner closely with the brightest minds in healthcare to ensure that every solution we create melds the latest technology with compassion and empathy. Because at Solventum, we never stop solving for you.
The Impact You’ll Make in this Role

As a Software Engineer your primary responsibilities will include working as a full stack developer using Java/SpringBoot using solid engineering practices and objected oriented principles.
Developing software components using solid engineering practices and objected oriented principles
Working with software architects, software engineers, quality engineers, and other team members to design, build, test, and deploy required systems
Coordinating and communicating with clinical analysts, product analysts, quality analysts, and other software engineers
Adhering to team design and coding procedures and standards
Helping to resolve escalated customer support issues
Occasionally interacting with customers to resolve operational problems and determine customer requirements. Work in an Agile environment, be responsible for supporting team goals for each sprint by pitching in to help others with their tasks. In a typical day you may work along-side a Java Full-Stack Developer, fellow Software Engineer, Software Architect, Software Developer, and more.
Design and develop automation to assist with increasing the quality of deliverables and to speed the time to software delivery.
Participate in retrospective reviews to identify process improvement ideas and implement
Your Skills and Expertise
To set you up for success in this role from day one, Solventum requires (at a minimum) the following qualifications:
Bachelor’s Degree or higher from (completed and verified prior to start) from an accredited institution
OR
High School Diploma/GED or higher from a (completed and verified prior to start) and a minimum fourteen (14) years of experience in Information technology
Ten (10) years of experience in software engineering
Additional qualifications that could help you succeed even further in this role include:
Full Stack Engineer with experience in Angular and/or React. Postgres database experience.
Desired: Java Spring Boot
Experience with Microservices, Hibernate, Flyway, SQL Databases, Redis
JIRA/Confluence/similar
Healthcare background IT with HL7, HIPAA, EMR integrations.
Strong analytical skills, excellent communication skills and ability to effectively collaborate with cross-functional teams
Experience with technical solutions that aid in detecting and mitigating security threats
Knowledge of relevant legal/regulatory frameworks and standards, such as NIST, ISO, GDPR, CMMC, FedRamp, StateRamp
Work location:
Remote
Travel: May include up to 15% domestic/international
Relocation Assistance: Not authorized
Must be legally authorized to work in country of employment without sponsorship for employment visa status (e.g., H1B status).
Supporting Your Well-being
Solventum offers many programs to help you live your best life – both physically and financially. To ensure competitive pay and benefits, Solventum regularly benchmarks with other companies that are comparable in size and scope.
Onboarding Requirement: To improve the onboarding experience, you will have an opportunity to meet with your manager and other new employees as part of the Solventum new employee orientation. As a result, new employees hired for this position will be required to travel to a designated company location for on-site onboarding during their initial days of employment. Travel arrangements and related expenses will be coordinated and paid for by the company in accordance with its travel policy. Applies to new hires with a start date of October 1st 2025 or later.
Applicable to US Applicants Only:The expected compensation range for this position is $119,076 - $145,537, which includes base pay plus variable incentive pay, if eligible. This range represents a good faith estimate for this position. The specific compensation offered to a candidate may vary based on factors including, but not limited to, the candidate’s relevant knowledge, training, skills, work location, and/or experience. In addition, this position may be eligible for a range of benefits (e.g., Medical, Dental & Vision, Health Savings Accounts, Health Care & Dependent Care Flexible Spending Accounts, Disability Benefits, Life Insurance, Voluntary Benefits, Paid Absences and Retirement Benefits, etc.). Additional information is available at: https://www.solventum.com/en-us/home/our-company/careers/#Total-Rewards
Responsibilities of this position include that corporate policies, procedures and security standards are complied with while performing assigned duties.
Solventum is committed to maintaining the highest standards of integrity and professionalism in our recruitment process. Applicants must remain alert to fraudulent job postings and recruitment schemes that falsely claim to represent Solventum and seek to exploit job seekers.
Please note that all email communications from Solventum regarding job opportunities with the company will be from an email with a domain of @solventum.com. Be wary of unsolicited emails or messages regarding Solventum job opportunities from emails with other email domains.
Please note, Solventum does not expect candidates in this position to perform work in the unincorporated areas of Los Angeles County.
Solventum is an equal opportunity employer. Solventum will not discriminate against any applicant for employment on the basis of race, color, religion, sex, sexual orientation, gender identity, national origin, age, disability, or veteran status.
Please note: your application may not be considered if you do not provide your education and work history, either by: 1) uploading a resume, or 2) entering the information into the application fields directly.
Solventum Global Terms of Use and Privacy Statement

Carefully read these Terms of Use before using this website. Your access to and use of this website and application for a job at Solventum are conditioned on your acceptance and compliance with these terms.
Please access the linked document by clicking here, select the country where you are applying for employment, and review. Before submitting your application you will be asked to confirm your agreement with the
terms.",N/A,https://www.indeed.com/pagead/clk?mo=r&ad=-6NYlbfkN0ByeVv9gQvIolStZLnA-WK3vbVxNQEdfwwQYjA4iiHd-spyQLFVEcdHURf_JRTJrq5ALTywiIL77CSNWnbtwM5ljzR9nvmbvu6jdZZXSbvhexmk_WfA0Fzw1syNsMwUeeGfhKzaKWqDSBdgAJ3H8c9vm9yT6g1hLkMQBE6jzZu-BaJGg_BVcI3IgVv6LzZlGXsXlsOUzGRWBp-NGE9vNWzi-vx8km2-KRJWNBPcROgekUWAK1knGXjF8tdGEdI7N3v70tQ1RNnn_KEN0jaVhxXu0egsz3wI6sO8r9xMxin6x3WNlf12_SdHMKnneOmLL3WrGUN--m5U0QwzktW_OWMug1QR0endSWwRdhuIQkFdrC0cRsXoOpzHFivfKhQsK0yqyAKkxGB-TaSm5m_y4oDzicrc5V23dfTmBNqoZVZcFCxNklqFlepQeFwd4pjPEyRoiSleCUoKawjq5OMajEA2Mero2KkKGOXa6rRxxVWyMRMor8ybqfOci1gdUPw1SIoIuSvkKeLtFnFnxDMNCSqB1Vm90khFCv_RtGu5roZJpAdoOmdzE3S8VyQ1-d8SxlWtVbGcEnXU6qx3z7sHDp6Y6MrSw-0rYGR64xAZMZfwBs0qt5SpjrulToP8urixALM52DBTBsQFOCZancaJuO6GF9gVLz_X-zDtX-qWMa-W9fVbGFMecjSV&xkcb=SoCh6_M3v6hGgCSEqR0KbzkdCdPP&camk=ethIe0s0hedpFAOtb8zZhw==&p=0&fvj=0&vjs=3,False,software engineer,"['agile', 'angular', 'communication', 'compliance', 'cross-functional teams', 'data science', 'hibernate', 'hipaa', 'jira', 'microservices', 'react', 'redis', 'security', 'spring boot', 'sql']",{}
Software Engineer IV,KCI Telecommunications,Remote,remote,2025-08-04,Indeed,"Software Engineer 4
Embark on a dynamic career at one of the nation’s leading energy providers as a Software Engineer, where your code doesn't just power systems but propels us into a sustainable energy future. Join a team that thrives on innovation, as we harness cutting-edge technologies to shape the next generation of energy solutions and leave an indelible mark on the landscape of progress.
Typical Functions:
Creates, maintains, and enhances applications as part of a product team.
Leads, creates, maintains, and enhances applications as part of a product team.
Researches, evaluates, and implements new technology to optimize application efficiency and usability.
Designs new functionality based on product backlog priorities, and coordinates development efforts in collaboration with durable product team and cross-functional organizations
Leverages CICD automation and best practices to deliver quality solutions to our end users
Applies iterative development to continuously deliver value through frequent deployments
Mentors other application developers in cloud native development
Ensures adherence to appropriate design, coding, and cybersecurity standards.
Leads design and code walk-thru as a presenter or reviewer.
Maintains records to document system and programming development and revisions.
Required Qualifications:
Bachelor degree in Computer Science or a related discipline.
In lieu of a degree, 8 years of related business experience.
Work experience in addition to degree: 5-10 years as an IT Application Developer with an emphasis on fullstack AWS development.
Job-specific knowledge, skills or abilities:
Fullstack development
AWS
DynamoDB
NoSQL
Lambda
Cloudfront
Agile (Scrum and Kanban)
Git
CICD best practices
Testing strategies leveraging Jasmine and/or Karma
Full-stack regression testing.
Individuals with this role are required to:
Design and build highly complex software solutions using agile/XP/TDD.
Lead a team in programing well-designed, efficient code independently.
Collaborate with designers, developers, and product owners to build cloud native software solutions targeting PCF, Azure, AWS, mobile iOS/Android, etc.
Clearly communicate team wide progress and identify blocking processes/patterns that hold a team back.
Participate in paired programming and code reviews with mentees to expand the team’s collective knowledge and understanding of software engineering.
Complete independent research to refine best practices and present work to peers. Lead Software Engineers must possess:
A breadth of experience building software solutions (through a strong mix of independent research/projects and industry expertise).
7-9 years’ previous experience in software development. (Either 9 years of experience specifically in software development or seven years of experience in software development in combination with 2 years alternative experience in a related field).
Ideally has a portfolio of work – code samples, etc.
Significant familiarity and comfort in using IDEs.
Knows short-cuts and frequents operations that speeds up development time.
Deep and solid understanding of APIs. Have been involved in designing/building/implementing APIs.
Considered an expert of cloud-native software engineering best practices.
Familiarity with a several frameworks. Resulting code is concise and easy-to-follow.
Ability to build a custom framework (when necessary).
Experience with automation and optimization. Looks for ways to create repeatable patterns that increase the efficiency of the team.
Experience and ability to manage and optimize databases.
Understanding of functional programming and how to apply functional concepts in any language.
Quick to picking up a new language or adopting a more recent version of a language.
Familiarity and ability to comfortably work with multiple platforms.
Deep experience turning complex ideas into workable solutions.
Previous experience collaborating on a cross-functional team.
Deep understanding of development cycle.
Ability to debug and avoid future problems by building more robust solutions.
Ability to look at previous personal or team experience and use this to analyze mistakes/successes, draw conclusions, and design future solutions.
Resulting solutions have few bugs and quick remediation times.
Previous experience translating business needs into valuable solutions for customers.
Previous experience building solutions with vulnerabilities in mind.
Thinks in advance about possible system bottleneck, looks out for vulnerabilities and problems. Remediates these issues as part of design of a new solution.
Experience acting as a strong instructor for team members.
Experience building solutions with the larger team in mind. Solutions have the goal of improving software engineering at the team level.
Experience with teaching and mentoring team members at various levels.
Previous involvement in the long-term vision of projects and software engineering practices.
Demonstrated strong soft skills.
Expertise and ability to rapidly make decisions for the team.
A mastery of cyber security principles such as authentication, authorization and encryption.
Ability to recommend and leverage common security libraries applicable to their language stack and champion secure programming best practices.
In depth experience with common attack vectors, such as SQL injection, Denial of Service (DoS), Cross-Site Scripting, etc. and methods to limit exposure.
Coaches organization on the prevention and remediation of potential security vulnerabilities.
In depth experience working with multiple CI/CD stacks.
Guides product teams on the setup of CI/CD for new products and coaches organization on DevOps best practices.
Leads the evaluation and selection/development of new CI/CD tools and processes.
Turn complex ideas into manageable pieces of work to complete as part of a product team.
Coach and mentor software developers.
Provide technical guidance to leadership so that solutions are built with innovation and sustainability in mind.
Learn the business drivers of a product and help drive the technical direction of a product to fulfill the desired vision.
Recommend and implement best practices and innovative solutions to drive digital transformation in the organization.
Job Type: Full-time
Pay: $125,000.00 - $150,000.00 per year
Schedule:
8 hour shift
Monday to Friday
Education:
Bachelor's (Preferred)
Experience:
AWS Full Stack Development : 6 years (Required)
Language:
English (Required)
Work Location: Remote",N/A,https://www.indeed.com/pagead/clk?mo=r&ad=-6NYlbfkN0A6uaqJ-WxMqUntV5oTzty4ctXSOFJND_U-7hmfE4uTAHcSQ6ODSTHROgsSwg8CAmjKU78x6NdDavgn5roFSqrq3478ZlzvkLLYRGGdAssGwhc_FDjzKiuii_Bdqx8lnpeowkbjakt6OEPeDR_6W0E-TC19GOyIcEb41xN1CMAObBA6OzvRQuf_L0Wb0FBzYoWqQl-iSo0Io3SEG7t_MypntuAXqN6F87xUBgh-9FaUJP7oJCE5DKCRJV7ThClsZCREy-c-SYYcXA5TjQ0TCuV6-QdSH7g5M9LGrYs1vVhcQjM0KldpEqlYCCmdea5v_idYiX-NQlgL__tPT-Y0Fop9O4B1qKShXiMg8y2fwyiVZ2yx_pk3lR3XeJwCJlu2I5tjS212MmP5uoT7R9LtZkbPUHVJBJzNsbc7yT29e7jEU_4sTxbG07bsfNxqlMaghm7oa1483jVHHJqcK7RLdMalG5WihgukQDCkBYY5-uvJeqdHJ7_fE7QeYdcZveJ3soKvnzeNSi6QPhFb5dzLJNkL-jIbpBKWJzXGPjgddB6Kw1r9mCavbOGZBCqTDudoDUwsTVLS9SUaSV9cuhotX8od9UwSJdanjoWh4f-1B2ZF7Gt-jJR0dv5FWK9uHyxul9yLU05HS1HKGhEQQetNAR6KDlh7YQ-Sx1LIm2DK6-UFww==&xkcb=SoA86_M3v6hGgCSEqR0JbzkdCdPP&camk=ethIe0s0hec8O_kD53cJZg==&p=1&fvj=0&vjs=3,False,software engineer,"['agile', 'aws', 'azure', 'collaboration', 'cybersecurity', 'devops', 'dynamodb', 'encryption', 'git', 'innovation', 'kanban', 'karma', 'leadership', 'mentoring', 'organization', 'scrum', 'security', 'sql', 'testing']",{}
Senior Front-end Developer with Exp. with D3.js,Combined Computer Resources,Remote,remote,2025-08-04,Indeed,"Customer is looking for a Sr. Engineer / Front-end developer who has extensive experience building interactive dashboards including graphs and charts (similar to dashboards on etrade or fidelity). This is a startup company that will support life sciences / healthcare companies and provide AI driven data and workflow automation. Will create reusable components for interactive dashboards which can be customized based on client need. As new customers are onboarded, will lift data into platform to drive efficiencies and be able to easily integrate new companies (to be able to reengineer from the ground up).
Candidate will be responsible for the visual look and feel of the website / dashboards. Must have HTML, CSS and JavaScript, D3.js. Must have strong communication skills, able to pick up quickly, able to work with little direction and will probably work with offshore component at some point. Wants someone who worked in start-ups or smaller companies who is used to working on full scope, with little direction and quick deliverables.
Primary skills: HTML, CSS and JavaScript, D3.js extensive experience building interactive dashboards
Job Type: Contract
Pay: $60.00 - $75.00 per hour
Schedule:
8 hour shift
Work Location: Remote",N/A,https://www.indeed.com/pagead/clk?mo=r&ad=-6NYlbfkN0BldYzZX3Rc-W91WsmH5NHExfqmo1VnWi5oaah42hwmwEaUVXGz2km4DuRp5CbFy0GUGGk9zT_Ku20tKS_mbeEr0KtTmx3hJQhCY0CNxyCaxIDgifkxoSPRn1_eXLoAK0KgwuQ-FaytzTRPkMoovvicdAmssNL9uiEgO2YPErPplQ9WEyO9CWpfJbCiIRa7oryvAhSBadHy38M1sI1iPuckniK_EUAdaOlt96vKiWy-f56B9Tn4ER3ypdyZHrf-mf4ef0DLIjzAYwSXheadRoUFkXm6UJw3XIhUpenAXWsVjqwgonDxK-TfYO0VzYKQvOM_n9auwu_DltyJS457_wvgpgRKKpFts-I9xXUmQqDc6fYwcfejGYlVYJhPqGPF7KtrJusB2WpTSAz9Ztuh-l0TmdXGYtdZ8eYrnchKKuyeC7aX8ckQZj8UvZSNYIQGbz5VfTNAA0Jc1J7EiEdSHN7imiDIB2bZSR9taolsCHOTnk6EfewgNM7tB3HSoXburcG8rC0Hn22IanmtzAFxneYszpgWVsqVfSS1rCtGPL-1WwMfEnt6CCCT7xawJl5euGwWUwHj6oNT0gTOXzVlu6xhUzEWs6aM4LoBoNJXxrmP7juvGh89D0jEZH11Z-xSmVg6tjlxufzINsUJMRUZh7ENjKaD2RsYP4TD2TgQVzsRbA==&xkcb=SoAP6_M3v6hA6wgQeL0KbzkdCdPP&camk=4HOcmqOLYrBof6KEKnBRng==&p=0&fvj=0&vjs=3,False,front-end developer,"['ai', 'communication', 'css', 'd3.js', 'html']",{}
"Full Stack Developer - React, Node,Azure - FL, NJ, OR, PA - Active T4 or eligible",Business Compass LLC,Remote in Florida,remote in florida,2025-08-04,Indeed,"Location:
The position is remote, but the candidate must live in Florida, New Jersey, Oregon, and Pennsylvania only. Candidates from other states must be willing to relocate to any of these four states without any relocation assistance.
Security Clearance:
Active T4 Security Clearance or qualified to secure T4 Security Clearance
Overview:
We are seeking a talented and motivated Full-Stack Developer with proven experience in React.js, Node.js, and Microsoft Azure to join our dynamic and agile development team. As a key contributor, you will work across both the front-end and back-end of our web platforms, participating in every stage of the software development lifecycle — from design to deployment.
Your ability to collaborate across teams, think strategically, and build scalable, secure, and high-performance applications will play a crucial role in delivering innovative digital solutions that elevate user experience and business outcomes.
Responsibilities
Develop and maintain robust, scalable web applications using React.js (front-end) and Node.js (back-end).
Build RESTful APIs and server-side logic for seamless interaction between the front-end and back-end.
Architect and manage cloud-based services and deployments using Microsoft Azure, including Azure Container Service for containerized deployments.
Implement CI/CD pipelines and automate deployments using Azure DevOps.
Collaborate with UI/UX designers, product managers, and QA engineers to translate business needs into technical solutions.
Optimize applications for maximum performance, scalability, and maintainability.
Write unit, integration, and end-to-end tests; participate in code reviews.
Leverage Microsoft SQL Server for structured data storage and querying.
Integrate third-party APIs and services for enhanced functionality.
Follow Agile/Scrum methodologies to meet sprint goals and deliver high-quality features.
Skills & Qualifications
Must-Have:
Minimum 5 years of professional experience as a Full-Stack Developer or in a similar software engineering role.
Proficiency in React.js, JavaScript (ES6+), HTML5, and CSS3 for front-end development.
Expertise in Node.js with frameworks like Express.js for backend services.
Strong hands-on experience with Microsoft Azure, including:
Azure App Services
Azure Container Service (ACS)
Azure SQL
Azure DevOps (Pipelines, Repos, Boards)
Solid understanding of RBAC (Role-Based Access Control) and application security principles.
Proficiency in Microsoft SQL Server, including writing optimized SQL queries and stored procedures.
Familiarity with version control systems (Git/GitHub).
Nice-to-Have:
Experience with Azure Kubernetes Service (AKS) or Azure Functions.
Basic experience with C programming language.
Working knowledge of VBA for process automation (bonus).
Familiarity with Agile practices and tools like Jira, Trello, or Azure Boards.
Strong debugging, troubleshooting, and performance tuning skills.
Education:
Minimum Bachelors of Science in Computer Science or related Technology fields.
Interview process:
Online test
Interviw via video conference
In-person interview
Job Type: Full-time
Pay: From $90,000.00 per year
Benefits:
Paid holidays
Paid time off
Schedule:
8 hour shift
Day shift
Monday to Friday
Application Question(s):
Are you located in Florida, New Jersey, Oregon, or Pennsylvania? If not, can you relocate there without relocation assistance?
Do you possess active T4 Security Clearance or will you qualify to obtain T4 Security Clearance, which has a US Citizenship requirement?
Education:
Bachelor's (Required)
Experience:
Full-stack development: 5 years (Required)
Node.js: 5 years (Required)
Work Location: Remote",N/A,https://www.indeed.com/pagead/clk?mo=r&ad=-6NYlbfkN0BPRfSWEQwvrcuRQv621Y0orbEGVQtpNBeQfy_Vgd7IDeTPNsMyJm7Sp9JZQ8TQUsaPdVT5Z_AOtYfnk0SeTuFmntJwtrS-vUpJkhtoWEElzFZ6NE_K48QIR7Tcghwdw6VfKYEmhd0XJhtXzVDP_ir5xY2YhoZzyBPo50DDKSkao3_P00b9fx-B4bfneC7X2lGsCuetjUh0gJ2bOWgY_M2y83khWMMnWKVjSoKEm5awowuYEPKbgTAcmU6KojZv6Ska7RLKsiRcIDKjX5YTN9dNz43cj8khAxeplxD5ZL2UsJ1x5eQOrsUs0lDh_CCaXUFFIdfgKaFsDI2p5iChlwDpBSyzcZfyBHzt2ma5F3YDXaIoRDEfCQptShiF7TW-u2SGaBVDYD5lj05m-A09MfASh5ivUY_clYa-GmEgWo0np2GQ3Ts-KC3j4i3DUAxeEVKupJka8VdAQ1hW7C0M8LazyQWQ6BNwP-AKE7KdbksEM4RZ2ZSsaeX_5ZNYVqEDqWlsSSKJH2xHR_crP0NqcBXnsTU-0N6RseZZb1r0sv4Jx2pMPTfduir9nfEsBOMchcFEZSl4F-KF4byDpIWdO2yDAMdUFDvmU47WWFEbJL9gkDO5MjJY_jY4OMfF6l8r8yqeLieYpEuuR-rJZ52QvopLmnH9sBx6A8tvtUlQWc6OAtkj5ux9id-lgswfv6ma2GCnrN361ekTU5B04uR3DYsoOzBmJMeekjefo1fKoG2AVg==&xkcb=SoCS6_M3v6hA6wgQeL0JbzkdCdPP&camk=ethIe0s0hecA_pgMz7JKig==&p=1&fvj=0&vjs=3,False,front-end developer,"['agile', 'azure', 'devops', 'express.js', 'full-stack development', 'git', 'github', 'jira', 'kubernetes', 'node.js', 'react', 'scrum', 'security', 'sql', 'trello', 'user experience', 'version control']",{}
