title,company,job_location,job_state,date,site,job_description,salary,url,applied,search_term,flat_skills,skills_by_category
Principal Software Engineer,Mind Education,Remote,remote,2025-07-16,Indeed,"MIND Research Institute seeks a Principal Software Engineer in Irvine, CA to architect and develop key games for our next generation educational software platform; Participate in agile, iterative planning activities; Work with education professionals to analyze, diagnose, and fix usability and learning issues; Perform peer design and code reviews and provide feedback to internal and external development teams; Work closely with the QA team to ensure that test plans address all of the features and capabilities of our games and that they meet the desired specifications; Help define development guidelines and advise on the technology stack to be used for the next generation of MIND’s educational games; 100% Telecommuting permitted from anywhere in the U.S. BS+4. $117,730-$165,390/yr. To apply, please send CV & cover letter to HR@mindresearch.org with ref#GS0525.",N/A,https://www.indeed.com/rc/clk?jk=d74a56e70b12d714&bb=Cjyl0Gl4RUrZP7hTg-mNtZWgi4QeMzwnf4_SRsQt4yk7-i1U1UyHKizo_qxZoMXc4TwbjlvRl3_6AYJoCGJsT6ajD1kQ0SrMLOZdz4iPa6AU6cdfkP0H9wlzXDG-E7DEGxl3hQznGbVnQcgzE1KVOw%3D%3D&xkcb=SoDg67M3vKHxl7yO4h0JbzkdCdPP&fccid=7af06c1d01b1d3f5&vjs=3,False,software engineer,['agile'],"{'Languages & Scripting': ['r'], 'Frontend Frameworks & Libraries': ['lit'], 'Dev Practices & Concepts': ['agile']}"
Senior Software Engineer,Anvilogic Inc,Remote,remote,2025-07-16,Indeed,"Anvilogic is a Palo Alto-based AI cybersecurity startup founded in 2019 by security veterans and data scientists from Fortune 500 companies.
Our mission is to democratize threat detection and hunting for today’s SOC teams to easily be done across hybrid, multi-clouds and security data lakes without needing to centralize data or rip and replace tools. Further, with our investments in AI-powered automation of detection-as-code to create, test, tune and deploy detections, SOC users can implement high-efficacy detection and hunting techniques without writing a single line of code nor manually wrangling data.
Anvilogic raised $45M Series C funding in April 2024 and is backed by top-tier VC firms and prominent industry executives. Anvilogic’s AI-powered Multi-Data Platform SIEM is used by many of the industry’s most advanced security teams.
Learn about our customers: anvilogic.com/customers
Role Description
Join our established and collaborative team building critical product features that directly impact company revenue. We own and operate core services—including AI-driven workflows and multi-platform data querying—that are central to our success. This is a high-impact role where your work will be closely aligned with both product strategy and customer value.
Write clean, maintainable, and well-tested code following engineering best practices.
Collaborate across teams, including engineering, product, and data science, to define and deliver high-quality solutions.
Contribute to system design, technical specifications, and architecture decisions.
Monitor production systems, respond to alerts, and troubleshoot issues when they arise.
Review pull requests and provide constructive feedback to uphold code quality standards.
Take initiative being a technical leader on the team.
Requirements
Minimum Qualifications
5+ years of software development experience with fluency in Python 3
Excellent written and verbal communication skills
Solid understanding of relational databases and ORM tools (e.g., SQLAlchemy)
Hands-on experience building REST APIs using frameworks like Flask, FastAPI, or Django
Experience in designing and building large systems (microservices, queues, schedules).
Strong experience with test-driven development and writing functional/integration tests
Familiarity with AWS services (Lambda, SQS, ECS, etc.)
Familiarity with CI/CD practices and tools to support automated testing and deployment pipelines
Preferred Qualifications
Experience working with Large Language Models (LLM), implementing standard patterns (RAG, Tools), and leveraging popular frameworks (LangGraph, Llama-index, Autogen)
Experience deploying services using infrastructure-as-code tools (AWS SAM, CloudFormation)
Experience querying datalakes or SIEMs (Snowflake, Databricks, Azure, Splunk, etc…)
Background in cybersecurity or experience working with security operations teams
Familiarity with security data (e.g., endpoint and network logs)
Benefits
Base Salary Range: $155,000 – $170,000 annually. Final compensation will depend on experience, qualifications, and location
Competitive salary with equity in the company
Comprehensive medical, dental, and vision insurance
Unlimited paid time off policy for work life balance
401(k) retirement plan with company match
Monthly stipend for home internet and cell phone expenses",N/A,https://www.indeed.com/rc/clk?jk=206bd3f44427a192&bb=Cjyl0Gl4RUrZP7hTg-mNtVDNMKZ4MAWIf-tvJ-B3s5rpvZvh4yVIcYMn6L4Nsaf9ktxRf9AC9HSa9IrDtf4UI35JRpDx21dRMx9_LTendeuLxJXdLZA-_GTtQmdSi-SeL4BCxg_Hfh9W6BOEbaIS_Q%3D%3D&xkcb=SoBU67M3vKHxl7yO4h0IbzkdCdPP&fccid=ad0f43603cfbcae0&vjs=3,False,software engineer,"['ai', 'aws', 'azure', 'cloudformation', 'communication', 'cybersecurity', 'data science', 'databricks', 'fastapi', 'microservices', 'orm', 'python', 'security', 'snowflake', 'testing']","{'Languages & Scripting': ['python', 'sql', 'go', 'r'], 'Frontend Frameworks & Libraries': ['lit'], 'Backend & API': ['flask', 'django', 'fastapi', 'rest', 'microservices', 'rest apis'], 'Databases & Storage': ['snowflake'], 'ORMs & Data Layers': ['sqlalchemy'], 'Cloud & Infrastructure': ['aws', 'azure', 'cloudformation'], 'DevOps & CI/CD': ['ci/cd'], 'Security & Identity': ['siem'], 'Testing & QA': ['pact'], 'Soft Skills': ['communication', 'initiative', 'vision']}"
Front End Developer,Track 25 LLC,Remote,remote,2025-07-16,Indeed,"We're seeking a senior/experienced Front End ReactJS Developer to join a high-performing team building next-generation television experiences. You’ll work on apps used by millions — primarily built with ReactJS and Brightscript for Roku and other streaming platforms. TV App experience is highly desired.
If you love solving complex UI problems, integrating APIs, and optimizing for large screens and living room devices, this is your kind of project.
Responsibilities:
Develop high-quality TV app interfaces using ReactJS, following design specifications closely
Integrate RESTful APIs and manage data in modern JavaScript workflows
Collaborate with designers and backend engineers to deliver seamless OTT (over-the-top) streaming experiences
Contribute to Brightscript development for Roku apps, and assist in maintaining or enhancing existing codebases
Troubleshoot, debug, and optimize apps for performance across TV platforms
Required Qualifications:
7+ years of recent experience with ReactJS in production environments
Strong experience consuming APIs from ReactJS apps and managing state (e.g., Redux, Context API)
Current experience developing user interfaces to design specifications is a must
Proficiency with JavaScript (ES6+)
Ability to translate Figma/Sketch designs into pixel-perfect UI
Clear understanding of responsive and adaptive design, especially for TV devices
Preferred Qualifications:
Background in mobile app development (React Native or native iOS/Android)
Experience with Roku's Brightscript and Roku SceneGraph development
Familiarity with TV app SDKs (Fire TV, Android TV, Apple TV)
Experience in publishing or certifying apps on Roku or other OTT platforms
Contract Details:
100% Remote
Contract length: 6–12 months, with potential for extension
Flexible working hours, but availability for some overlap with U.S. time zones preferred
Why This Role?
Join a fast-moving team focused on building streaming experiences for millions of viewers
Work with modern frameworks and cutting-edge technologies
Help shape the future of how people engage with digital entertainment
If you are passionate about application development and eager to contribute to exciting projects, we encourage you to apply. Join us in creating innovative solutions that make a difference!
Job Types: Full-time, Contract
Pay: $65.00 - $95.00 per hour
Expected hours: 40 per week
Benefits:
401(k)
Dental insurance
Health insurance
Vision insurance
Schedule:
8 hour shift
Monday to Friday
Work Location: Remote",N/A,https://www.indeed.com/rc/clk?jk=f24d5a4d3fc85215&bb=Cjyl0Gl4RUrZP7hTg-mNtQVFp2XDTVsjMjEzDY6jg0_mwpchIf10HTROZyTHved4G5c8cEIV5YrXrEWQPXIgf_6l8Y8Ujjte9JC6mBOWgFrZZ6nfwySRzUAHIVJeOWkPA3IxbiHzjObyAhhsACxJRg%3D%3D&xkcb=SoDa67M3vKHxl7yO4h0PbzkdCdPP&fccid=842862ea86d0cb2e&cmp=Track-25-LLC&ti=Front+End+Developer&vjs=3,False,software engineer,"['figma', 'react', 'react native', 'sketch']","{'Languages & Scripting': ['javascript', 'java', 'r'], 'Frontend Frameworks & Libraries': ['react', 'react native', 'redux', 'lit'], 'Mobile Development': ['android', 'ios'], 'Backend & API': ['rest'], 'Testing & QA': ['ava'], 'Project & Tools': ['figma'], 'Soft Skills': ['vision']}"
Full-Stack Software Engineer,Nava,Remote,remote,2025-07-16,Indeed,"About Nava Benefits
Nava Benefits is one of the fastest growing benefits brokerages in America and the first to fuse cutting edge technology with benefits expertise to deliver an end to end benefits solution for growing businesses. Through better renewal strategy, benefits back-office support, and a modern member experience, employers turn to Nava to lower costs, delight employees, and augment HR teams. Nava is driven by the mission to fix healthcare in America, starting with the 160M Americans who get their healthcare through employers. Backed by leading investors and founded by seasoned entrepreneurs, we're an ambitious group of people transforming the $50B / year benefits brokerage industry, and making a positive impact on the lives of Americans across the country.
Role Overview: As a Full-Stack Software Engineer, you will be part of a Product squad to create tech-forward, AI-driven solutions that help HR teams and their employees navigate the complex world of benefits and healthcare. You will leverage cutting-edge technologies, including AI and machine learning, to drive the development of scalable, intelligent applications that enable more automated and efficient business processes through exceptional user experiences.
Key Responsibilities:
Build web application / product features where you will apply programming principles and algorithms to design and implement scalable and robust systems with a focus on simplicity and efficiency.
Collaborate cross-functionally with Product, User Experience, Business Operations and AI to weigh trade-offs of near and long term solutions.
Support engineering through leadership, mentorship and leading by example – setting high standards for personal and team's code quality, test coverage and performance.
Drive innovation through the use of AI tools and platforms for developing software and implementing solutions.
️ Preferred Experience:
3+ years of software engineering experience.
Experience working in a fast-paced startup environment, with strong proven execution skills to deliver end-to-end functionality with data-driven feedback loops.
Highly proficient in developing modern full-stack web applications on client- and server- side.
Skilled in using AI coding tools to enhance software development and productivity, and proven track record as a change agent in development teams with deploying and using AI.
Familiarity with REST APIs integration and development.
Experience using AI models from OpenAI, Anthropic Gemini, LLMs, etc., to build AI-powered solutions.
Working knowledge of cloud infrastructure and deployment.
Proven ability to lead and work well with cross-functional teams on complex projects.
Excellent communication skills with technical and non-technical stakeholders in handling complex decisions and changes.
️ Our Tech Stack:
Frontend: React / Vite / Next.js
Backend: Node / Nest.js / Express.js
API: REST / Graphql
AI: OpenAI / different AI platforms
Language: Typescript
Database: Postgres
Infrastructure: AWS
Commitment to Diversity & Inclusion
We believe that solving America's healthcare problems requires leveraging our nation's diversity. We are committed to creating an equitable and inclusive work environment and strongly encourage applicants from all backgrounds to apply. Applicants for this engineering position must be currently authorized to work in the United States on a full-time basis with no need for sponsorship now or in the future. We are seeking a Senior Software Engineer who embodies our core values: Own the Outcome, Be a Great Co-pilot, Drive Progress Through Action, and Create Super Fans.
Benefits:
Health & Wellness: Medical insurance, including a $0 premium HDHP plan for individuals, Dental, Vision, Telehealth and Virtual Primary Care Visits, OneMedical membership, Wellhub, and a $50 monthly benefit to improve your mental or physical health.
Financial Support: Stock options, 401(k) with a $2,000 match, FSA, HSA, and access to Origin Financial.
Work-Life: Flexible PTO, 12 weeks of paid parental leave with 2 weeks of transition time, $50 monthly connectivity reimbursement, and company-paid short-term disability, long-term disability, and life insurance, with additional voluntary benefits like supplemental life, AD&D, hospital indemnity, accident, and critical illness coverage.
Professional Support: $1,000 home office setup stipend and access to an Employee Assistance Program (EAP).",N/A,https://www.indeed.com/rc/clk?jk=7b28e851b64e0814&bb=Cjyl0Gl4RUrZP7hTg-mNtQ_miFqJLowA5FlowyoTjJgkZhe3s887YwVyskOu3FqRmBweUTpSz00UCKuDL2rImnd63NrV0TH4yM2JbIy8rlzgUBMnvYjdY1W4FN6annFeVQdWdJ_1naOKom1MiIWMow%3D%3D&xkcb=SoBu67M3vKHxl7yO4h0ObzkdCdPP&fccid=d2909e5aa716400c&vjs=3,False,software engineer,"['ai', 'aws', 'communication', 'cross-functional teams', 'express.js', 'frontend', 'gemini', 'graphql', 'innovation', 'leadership', 'machine learning', 'next.js', 'openai', 'productivity', 'react', 'typescript', 'user experience']","{'Languages & Scripting': ['typescript', 'go', 'graphql', 'r', 'scala'], 'Frontend Frameworks & Libraries': ['react', 'next.js', 'vite', 'lit'], 'Backend & API': ['express.js', 'rest', 'rest apis'], 'Cloud & Infrastructure': ['aws'], 'Testing & QA': ['ava', 'pact'], 'Data Science & AI': ['openai', 'llms', 'anthropic', 'gemini'], 'Soft Skills': ['communication', 'leadership', 'mentorship', 'vision', 'innovation']}"
WordPress Developer,Inncompass LLC,Remote,remote,2025-07-16,Indeed,N/A,N/A,https://www.indeed.com/rc/clk?jk=a67769054cbf7436&bb=Cjyl0Gl4RUrZP7hTg-mNtc_0wyJOoiahj2yByPPqxtE7h6BQBoRq5WUvmNYjCc2c3kdaPkFnIEJk9cth7RooRczSF7mXGXoaVqmxvK57BcpYNiXofZu5_tIe7l7S40vKrEs7wlalV-Q3apGk2KYktg%3D%3D&xkcb=SoDz67M3vKHxl7yO4h0NbzkdCdPP&fccid=3da86769816cdb32&cmp=Inncompass&ti=Wordpress+Developer&vjs=3,False,software engineer,[],{}
